{
  "project": "TSPS",
  "phase": "Phase A Sprint 2D",
  "graph_version": "0.1.0",
  "source_policy": "Graph generated from canonical module files only.",
  "entities": [
    {"id":"CM-01","type":"canonical_module","name":"Executive Summary","path":"canonical/01_Executive_Summary.md","integrity_hash":"CM-01-LOCKED-v2.0"},
    {"id":"CM-02","type":"canonical_module","name":"Country Positioning Matrix","path":"canonical/02_Country_Positioning_Matrix.md","integrity_hash":"CM-02-LOCKED-v2.0"},
    {"id":"CM-03","type":"canonical_module","name":"Strategic Positioning","path":"canonical/03_Strategic_Positioning.md","integrity_hash":"CM-03-LOCKED-v2.0"},
    {"id":"CM-04","type":"canonical_module","name":"SWOT Analysis","path":"canonical/04_SWOT_Analysis.md","integrity_hash":"CM-04-LOCKED-v2.0"},
    {"id":"CM-05","type":"canonical_module","name":"Strategic Positioning Assessment Framework","path":"canonical/05_Strategic_Positioning_Assessment_Framework.md","integrity_hash":"CM-05-LOCKED-v2.0"},
    {"id":"CM-06","type":"canonical_module","name":"Strategic Positioning & Go-to-Market Logic","path":"canonical/06_Strategic_Positioning_and_Go_to_Market_Logic.md","integrity_hash":"CM-06-LOCKED-v2.0"},
    {"id":"CM-07","type":"canonical_module","name":"Primary African Anchor Market","path":"canonical/07_Primary_African_Anchor_Market.md","integrity_hash":"CM-07-LOCKED-v2.0"},
    {"id":"CM-08","type":"canonical_module","name":"South Africa Market Validation","path":"canonical/08_South_Africa_Market_Validation.md","integrity_hash":"CM-08-LOCKED-v2.0"},
    {"id":"CM-09","type":"country_module","country":"South Africa","name":"South Africa","path":"canonical/09_South_Africa.md","integrity_hash":"CM-09-LOCKED-v2.0"},
    {"id":"CM-10","type":"country_module","country":"Vietnam","name":"Vietnam","path":"canonical/10_Vietnam.md","integrity_hash":"CM-10-LOCKED-v2.0"},
    {"id":"CM-11","type":"country_module","country":"Indonesia","name":"Indonesia","path":"canonical/11_Indonesia.md","integrity_hash":"CM-11-LOCKED-v2.0"},
    {"id":"CM-12","type":"country_module","country":"India","name":"India","path":"canonical/12_India.md","integrity_hash":"CM-12-LOCKED-v2.0"},
    {"id":"CM-13","type":"country_module","country":"United Arab Emirates","name":"United Arab Emirates","path":"canonical/13_United_Arab_Emirates.md","integrity_hash":"CM-13-LOCKED-v2.0"},
    {"id":"CM-14","type":"country_module","country":"Saudi Arabia","name":"Saudi Arabia","path":"canonical/14_Saudi_Arabia.md","integrity_hash":"CM-14-LOCKED-v2.0"},
    {"id":"CM-15","type":"country_module","country":"Oman","name":"Oman","path":"canonical/15_Oman.md","integrity_hash":"CM-15-LOCKED-v2.0"},
    {"id":"CM-16","type":"country_module","country":"Jordan","name":"Jordan","path":"canonical/16_Jordan.md","integrity_hash":"CM-16-LOCKED-v2.0"},
    {"id":"CM-17","type":"country_module","country":"Nigeria","name":"Nigeria","path":"canonical/17_Nigeria.md","integrity_hash":"CM-17-LOCKED-v2.0"},
    {"id":"CM-18","type":"country_module","country":"Mongolia","name":"Mongolia","path":"canonical/18_Mongolia.md","integrity_hash":"CM-18-LOCKED-v2.0"},
    {"id":"CM-19","type":"framework_module","name":"Country-Level TAM / SAM / SOM","path":"canonical/19_Country_Level_TAM_SAM_SOM.md","integrity_hash":"CM-19-LOCKED-v2.0"},
    {"id":"CM-20","type":"framework_module","name":"Product-Market Fit","path":"canonical/20_Product_Market_Fit.md","integrity_hash":"CM-20-LOCKED-v2.0"},
    {"id":"CM-21","type":"framework_module","name":"Strategic Market Prioritization Framework","path":"canonical/21_Strategic_Market_Prioritization_Framework.md","integrity_hash":"CM-21-LOCKED-v2.0"},
    {"id":"CM-22","type":"roadmap_module","name":"International Expansion Roadmap","path":"canonical/22_International_Expansion_Roadmap.md","integrity_hash":"CM-22-LOCKED-v2.0"},
    {"id":"CM-23","type":"conclusion_module","name":"Strategic Conclusions","path":"canonical/23_Strategic_Conclusions.md","integrity_hash":"CM-23-LOCKED-v2.0"}
  ],
  "relationships": [
    {"from":"CM-01","to":"CM-02","type":"depends_on"},{"from":"CM-01","to":"CM-19","type":"depends_on"},{"from":"CM-01","to":"CM-20","type":"depends_on"},{"from":"CM-01","to":"CM-21","type":"depends_on"},{"from":"CM-01","to":"CM-22","type":"depends_on"},{"from":"CM-01","to":"CM-23","type":"depends_on"},
    {"from":"CM-02","to":"CM-01","type":"depends_on"},{"from":"CM-02","to":"CM-03","type":"depends_on"},{"from":"CM-02","to":"CM-09","type":"depends_on_group_member"},{"from":"CM-02","to":"CM-18","type":"depends_on_group_member"},{"from":"CM-02","to":"CM-21","type":"depends_on"},{"from":"CM-02","to":"CM-22","type":"depends_on"},
    {"from":"CM-03","to":"CM-01","type":"depends_on"},{"from":"CM-03","to":"CM-02","type":"depends_on"},{"from":"CM-03","to":"CM-04","type":"depends_on"},{"from":"CM-03","to":"CM-05","type":"depends_on"},{"from":"CM-03","to":"CM-06","type":"depends_on"},{"from":"CM-03","to":"CM-20","type":"depends_on"},
    {"from":"CM-04","to":"CM-01","type":"depends_on"},{"from":"CM-04","to":"CM-03","type":"depends_on"},{"from":"CM-04","to":"CM-05","type":"depends_on"},{"from":"CM-04","to":"CM-06","type":"depends_on"},{"from":"CM-04","to":"CM-20","type":"depends_on"},{"from":"CM-04","to":"CM-22","type":"depends_on"},
    {"from":"CM-05","to":"CM-03","type":"depends_on"},{"from":"CM-05","to":"CM-04","type":"depends_on"},{"from":"CM-05","to":"CM-06","type":"depends_on"},{"from":"CM-05","to":"CM-20","type":"depends_on"},{"from":"CM-05","to":"CM-21","type":"depends_on"},
    {"from":"CM-06","to":"CM-03","type":"depends_on"},{"from":"CM-06","to":"CM-05","type":"depends_on"},{"from":"CM-06","to":"CM-20","type":"depends_on"},{"from":"CM-06","to":"CM-21","type":"depends_on"},{"from":"CM-06","to":"CM-22","type":"depends_on"},{"from":"CM-06","to":"CM-09","type":"depends_on_group_member"},{"from":"CM-06","to":"CM-18","type":"depends_on_group_member"},
    {"from":"CM-07","to":"CM-02","type":"depends_on"},{"from":"CM-07","to":"CM-06","type":"depends_on"},{"from":"CM-07","to":"CM-09","type":"depends_on"},{"from":"CM-07","to":"CM-21","type":"depends_on"},{"from":"CM-07","to":"CM-22","type":"depends_on"},
    {"from":"CM-08","to":"CM-07","type":"depends_on"},{"from":"CM-08","to":"CM-09","type":"depends_on"},{"from":"CM-08","to":"CM-20","type":"depends_on"},{"from":"CM-08","to":"CM-22","type":"depends_on"},
    {"from":"CM-09","to":"CM-02","type":"depends_on"},{"from":"CM-09","to":"CM-06","type":"depends_on"},{"from":"CM-09","to":"CM-07","type":"depends_on"},{"from":"CM-09","to":"CM-08","type":"depends_on"},{"from":"CM-09","to":"CM-19","type":"depends_on"},{"from":"CM-09","to":"CM-20","type":"depends_on"},{"from":"CM-09","to":"CM-21","type":"depends_on"},{"from":"CM-09","to":"CM-22","type":"depends_on"},
    {"from":"CM-10","to":"CM-02","type":"depends_on"},{"from":"CM-10","to":"CM-06","type":"depends_on"},{"from":"CM-10","to":"CM-19","type":"depends_on"},{"from":"CM-10","to":"CM-20","type":"depends_on"},{"from":"CM-10","to":"CM-21","type":"depends_on"},{"from":"CM-10","to":"CM-22","type":"depends_on"},
    {"from":"CM-11","to":"CM-02","type":"depends_on"},{"from":"CM-11","to":"CM-06","type":"depends_on"},{"from":"CM-11","to":"CM-19","type":"depends_on"},{"from":"CM-11","to":"CM-20","type":"depends_on"},{"from":"CM-11","to":"CM-21","type":"depends_on"},{"from":"CM-11","to":"CM-22","type":"depends_on"},
    {"from":"CM-12","to":"CM-02","type":"depends_on"},{"from":"CM-12","to":"CM-06","type":"depends_on"},{"from":"CM-12","to":"CM-19","type":"depends_on"},{"from":"CM-12","to":"CM-20","type":"depends_on"},{"from":"CM-12","to":"CM-21","type":"depends_on"},{"from":"CM-12","to":"CM-22","type":"depends_on"},
    {"from":"CM-13","to":"CM-02","type":"depends_on"},{"from":"CM-13","to":"CM-06","type":"depends_on"},{"from":"CM-13","to":"CM-19","type":"depends_on"},{"from":"CM-13","to":"CM-20","type":"depends_on"},{"from":"CM-13","to":"CM-21","type":"depends_on"},{"from":"CM-13","to":"CM-22","type":"depends_on"},
    {"from":"CM-14","to":"CM-02","type":"depends_on"},{"from":"CM-14","to":"CM-06","type":"depends_on"},{"from":"CM-14","to":"CM-19","type":"depends_on"},{"from":"CM-14","to":"CM-20","type":"depends_on"},{"from":"CM-14","to":"CM-21","type":"depends_on"},{"from":"CM-14","to":"CM-22","type":"depends_on"},
    {"from":"CM-15","to":"CM-02","type":"depends_on"},{"from":"CM-15","to":"CM-06","type":"depends_on"},{"from":"CM-15","to":"CM-19","type":"depends_on"},{"from":"CM-15","to":"CM-20","type":"depends_on"},{"from":"CM-15","to":"CM-21","type":"depends_on"},{"from":"CM-15","to":"CM-22","type":"depends_on"},
    {"from":"CM-16","to":"CM-02","type":"depends_on"},{"from":"CM-16","to":"CM-06","type":"depends_on"},{"from":"CM-16","to":"CM-19","type":"depends_on"},{"from":"CM-16","to":"CM-20","type":"depends_on"},{"from":"CM-16","to":"CM-21","type":"depends_on"},{"from":"CM-16","to":"CM-22","type":"depends_on"},
    {"from":"CM-17","to":"CM-02","type":"depends_on"},{"from":"CM-17","to":"CM-06","type":"depends_on"},{"from":"CM-17","to":"CM-19","type":"depends_on"},{"from":"CM-17","to":"CM-20","type":"depends_on"},{"from":"CM-17","to":"CM-21","type":"depends_on"},{"from":"CM-17","to":"CM-22","type":"depends_on"},
    {"from":"CM-18","to":"CM-02","type":"depends_on"},{"from":"CM-18","to":"CM-06","type":"depends_on"},{"from":"CM-18","to":"CM-19","type":"depends_on"},{"from":"CM-18","to":"CM-20","type":"depends_on"},{"from":"CM-18","to":"CM-21","type":"depends_on"},{"from":"CM-18","to":"CM-22","type":"depends_on"},
    {"from":"CM-19","to":"CM-02","type":"depends_on"},{"from":"CM-19","to":"CM-09","type":"depends_on_group_member"},{"from":"CM-19","to":"CM-18","type":"depends_on_group_member"},{"from":"CM-19","to":"CM-20","type":"depends_on"},{"from":"CM-19","to":"CM-21","type":"depends_on"},{"from":"CM-19","to":"CM-22","type":"depends_on"},